[
  {
    "as_of": "2026-08-15",
    "country_code": "AE",
    "definition": "Three Abu Dhabi municipality jurisdictions named as DMT sub-sector regulatory authorities",
    "denominator": 3,
    "id": "DEN-AE-ABU-DHABI-MUNICIPALITY-JURISDICTIONS",
    "layer": "abu_dhabi_municipality_jurisdictions",
    "license": "Official Abu Dhabi government page; reuse terms not stated",
    "missing_reason": null,
    "notes": "Authority: Department of Municipalities and Transport. A bounded official layer is complete only when matched + excluded equals its source-backed denominator.",
    "schema_version": "2.0.0",
    "snapshot_date": "2026-08-15",
    "source_id": "SRC-AE-DMT-THREE-MUNICIPALITIES-2026",
    "source_locator": "paragraph naming all three municipalities",
    "status": "official",
    "value": 3
  },
  {
    "as_of": "2026-08-15",
    "country_code": "AE",
    "definition": "Three named Ajman constituents with source-mixed city/area wording",
    "denominator": 3,
    "id": "DEN-AE-AJMAN-CONSTITUENTS",
    "layer": "ajman_constituents",
    "license": "Official Ajman government page; reuse terms not stated",
    "missing_reason": null,
    "notes": "Authority: Government of Ajman. A bounded official layer is complete only when matched + excluded equals its source-backed denominator.",
    "schema_version": "2.0.0",
    "snapshot_date": "2026-08-15",
    "source_id": "SRC-AE-AJMAN-ABOUT-2026",
    "source_locator": "overview naming Ajman, Manama and Masfout",
    "status": "official",
    "value": 3
  },
  {
    "as_of": "2026-08-15",
    "country_code": "AE",
    "definition": "ISO country entity in the project's 22-country scope",
    "denominator": 1,
    "id": "DEN-AE-COUNTRY-SCOPE",
    "layer": "country_scope",
    "license": "ISO copyright; reuse is subject to ISO terms of use",
    "missing_reason": null,
    "notes": "Authority: International Organization for Standardization. A bounded official layer is complete only when matched + excluded equals its source-backed denominator.",
    "schema_version": "2.0.0",
    "snapshot_date": "2026-08-15",
    "source_id": "SRC-ISO-3166-1-2020",
    "source_locator": "ISO alpha-2 entry AE",
    "status": "official",
    "value": 1
  },
  {
    "as_of": "2026-08-15",
    "country_code": "AE",
    "definition": "Dubai three-digit planning communities; official layer available but enumerable denominator unavailable in this snapshot",
    "denominator": null,
    "id": "DEN-AE-DUBAI-PLANNING-COMMUNITIES",
    "layer": "dubai_planning_communities",
    "license": "License not specified on captured dataset metadata",
    "missing_reason": "denominator_unavailable: official Community.kml metadata was found, but the file could not be retrieved or enumerated; no web list or selected statistical rows were treated as a denominator",
    "notes": "Authority: Dubai Municipality via Dubai Pulse. A bounded official layer is complete only when matched + excluded equals its source-backed denominator.",
    "schema_version": "2.0.0",
    "snapshot_date": "2026-08-15",
    "source_id": "SRC-AE-DUBAI-PULSE-COMMUNITIES-2025",
    "source_locator": "Community.kml metadata, updated 03 Nov 2025",
    "status": "unavailable",
    "value": null
  },
  {
    "as_of": "2026-08-15",
    "country_code": "AE",
    "definition": "Nine official numbered planning/statistical sectors of Dubai",
    "denominator": 9,
    "id": "DEN-AE-DUBAI-PLANNING-SECTORS",
    "layer": "dubai_planning_sectors",
    "license": "Official Dubai government publication; reuse terms not stated in captured index",
    "missing_reason": null,
    "notes": "Authority: Dubai Statistics Center; sector identifier metadata from Dubai Municipality. A bounded official layer is complete only when matched + excluded equals its source-backed denominator.",
    "schema_version": "2.0.0",
    "snapshot_date": "2026-08-15",
    "source_id": "SRC-AE-DSC-SECTORS-2022",
    "source_locator": "Population Distribution by Sector; Dubai divided into 9 sectors",
    "status": "official",
    "value": 9
  },
  {
    "as_of": "2026-08-15",
    "country_code": "AE",
    "definition": "Seven constituent emirates named by the federal government portal",
    "denominator": 7,
    "id": "DEN-AE-EMIRATES",
    "layer": "emirates",
    "license": "Official UAE Government portal; reuse terms not stated on captured page",
    "missing_reason": null,
    "notes": "Authority: The Official Platform of the UAE Government. A bounded official layer is complete only when matched + excluded equals its source-backed denominator.",
    "schema_version": "2.0.0",
    "snapshot_date": "2026-08-15",
    "source_id": "SRC-AE-FEDERAL-SEVEN-EMIRATES-2026",
    "source_locator": "complete seven-emirate enumeration",
    "status": "official",
    "value": 7
  },
  {
    "as_of": "2026-08-15",
    "country_code": "AE",
    "definition": "Two municipality authorities named as official GIS integration counterparts",
    "denominator": 2,
    "id": "DEN-AE-FUJAIRAH-MUNICIPAL-AUTHORITIES",
    "layer": "fujairah_municipal_authorities",
    "license": "Official Fujairah government page; reuse terms not stated",
    "missing_reason": null,
    "notes": "Authority: Government of Fujairah; Fujairah GIS Center. A bounded official layer is complete only when matched + excluded equals its source-backed denominator.",
    "schema_version": "2.0.0",
    "snapshot_date": "2026-08-15",
    "source_id": "SRC-AE-FUJAIRAH-GIS-2017",
    "source_locator": "GIS centre integration paragraph naming Fujairah Municipality and Dibba Municipality",
    "status": "official",
    "value": 2
  },
  {
    "as_of": "2026-09-23",
    "country_code": "AE",
    "definition": "unesco_intangible_heritage depth layer",
    "denominator": null,
    "id": "DEN-AE-ICH",
    "layer": "unesco_intangible_heritage",
    "license": "UNESCO ICH state page; factual extraction with attribution; CC BY-SA 3.0 IGO for the descriptions",
    "missing_reason": "knowledge/list layer: no spatial denominator is asserted and no percentage is calculated",
    "notes": "knowledge/list layer: no spatial denominator is asserted and no percentage is calculated",
    "schema_version": "2.0.0",
    "snapshot_date": "2026-09-23",
    "source_id": "SRC-UNESCO-ICH-AE-STATE-2026",
    "source_locator": "unesco_intangible_heritage depth layer",
    "status": "unavailable",
    "value": null
  },
  {
    "as_of": "2026-09-23",
    "country_code": "AE",
    "definition": "classified_local_knowledge depth layer",
    "denominator": null,
    "id": "DEN-AE-LOCAL",
    "layer": "classified_local_knowledge",
    "license": "Wikipedia text, CC BY-SA 4.0; used for classification only",
    "missing_reason": "knowledge/list layer: no spatial denominator is asserted and no percentage is calculated",
    "notes": "knowledge/list layer: no spatial denominator is asserted and no percentage is calculated",
    "schema_version": "2.0.0",
    "snapshot_date": "2026-09-23",
    "source_id": "SRC-AE-CUISINE-MIRROR-2026",
    "source_locator": "classified_local_knowledge depth layer",
    "status": "unavailable",
    "value": null
  },
  {
    "as_of": "2026-08-15",
    "country_code": "AE",
    "definition": "Named neighborhoods across all emirates",
    "denominator": null,
    "id": "DEN-AE-NEIGHBORHOODS",
    "layer": "neighborhoods",
    "license": "License not specified on captured dataset metadata",
    "missing_reason": "denominator_unavailable: no dated enumerable official cross-emirate neighborhood registry was established; no percentage is calculated",
    "notes": "Authority: Multiple local municipal authorities. A bounded official layer is complete only when matched + excluded equals its source-backed denominator.",
    "schema_version": "2.0.0",
    "snapshot_date": "2026-08-15",
    "source_id": "SRC-AE-DUBAI-PULSE-COMMUNITIES-2025",
    "source_locator": "community metadata and Al Shindagha context page; neither is an exhaustive neighborhood registry",
    "status": "unavailable",
    "value": null
  },
  {
    "as_of": "2026-09-23",
    "country_code": "AE",
    "definition": "heritage_places depth layer",
    "denominator": null,
    "id": "DEN-AE-PLACES",
    "layer": "heritage_places",
    "license": "UNESCO World Heritage state page; factual extraction with attribution",
    "missing_reason": "knowledge/list layer: no spatial denominator is asserted and no percentage is calculated",
    "notes": "knowledge/list layer: no spatial denominator is asserted and no percentage is calculated",
    "schema_version": "2.0.0",
    "snapshot_date": "2026-09-23",
    "source_id": "SRC-UNESCO-WH-AE-STATE-2026",
    "source_locator": "heritage_places depth layer",
    "status": "unavailable",
    "value": null
  },
  {
    "as_of": "2026-08-15",
    "country_code": "AE",
    "definition": "Cities, towns, villages, and other populated settlements",
    "denominator": null,
    "id": "DEN-AE-POPULATED-PLACES",
    "layer": "populated_places",
    "license": "Official UAE Government portal; reuse terms not stated on captured page",
    "missing_reason": "denominator_unavailable: no dated enumerable official UAE-wide registry of cities, towns, villages, or settlements was established; contextual page mentions are not a denominator",
    "notes": "Authority: Multiple emirate and municipal authorities. A bounded official layer is complete only when matched + excluded equals its source-backed denominator.",
    "schema_version": "2.0.0",
    "snapshot_date": "2026-08-15",
    "source_id": "SRC-AE-FEDERAL-SEVEN-EMIRATES-2026",
    "source_locator": "federal emirate overview; no exhaustive city/town/village registry",
    "status": "unavailable",
    "value": null
  },
  {
    "as_of": "2026-08-15",
    "country_code": "AE",
    "definition": "Five numbered administrative areas of Ras Al Khaimah",
    "denominator": 5,
    "id": "DEN-AE-RAK-ADMINISTRATIVE-AREAS",
    "layer": "rak_administrative_areas",